{
  "schema_version": "1.0.0",
  "experiment_id": "benchmark.toy-caesar-oracle-check",
  "version": "1.0.0",
  "title": "Toy Caesar oracle-scored transform check",
  "mode": "confirmatory",
  "registered_at": "2026-08-30T19:40:00Z",
  "proposers": [
    {
      "name": "Voynich@Home contract prototype",
      "role": "fixture author and implementer",
      "conflicts": "The same prototype created the fixture and worker; this is executable contract evidence, not an independent or sequestered benchmark."
    }
  ],
  "exposure_disclosure": [
    "The plaintext, ciphertext, transformation family, and correct shift are committed publicly and were visible during implementation."
  ],
  "hypothesis": {
    "family": "oracle-scored transform verification",
    "statement": "Exhaustive comparison of all 26 Caesar shifts against the disclosed plaintext oracle will select key 7 and reproduce all 25 fixture codepoints.",
    "falsifier": "The frozen worker selects any other key, scores fewer than 25 matching codepoints, or changes output across a restart or independent host.",
    "nearest_alternatives": [
      "The fixture was generated by another shift.",
      "The worker's encryption direction or tie-breaking implementation is incorrect."
    ]
  },
  "corpus": {
    "snapshot_digest": "sha256:044c6ffe48a0b57e389914697d8f687e5589e46942e6c3297dff5a3b362fb0c7",
    "view_ids": [
      "synthetic-caesar-ciphertext-v1"
    ]
  },
  "partitions": {
    "manifest_digest": "sha256:ec09d54f31392deb4570ea5a1cbeb85a1f375832ba236e7f49c6340b2ea437f2",
    "grouping_units": [
      "work"
    ],
    "roles": [
      "control",
      "confirmation"
    ]
  },
  "metrics": [
    {
      "metric_id": "exact-codepoint-match-count",
      "primary": true,
      "implementation_digest": "sha256:7b9bd1869b22419e77f5661492e1ed54fcb3c9489e555371f8a375f6c419a2a8",
      "direction": "higher",
      "threshold": "25",
      "smallest_effect": "1",
      "unit": "matching codepoints"
    }
  ],
  "multiplicity": {
    "claim_family_id": "toy-caesar-contract-family-v1",
    "procedure": "The complete 26-key selection pipeline must identify the one registered exact match; no single-key unadjusted claim is made.",
    "alpha": "0.05"
  },
  "controls": [
    {
      "control_id": "positive-caesar-7",
      "class": "positive",
      "artifact_digest": "sha256:8acd9d4e0e258b940b7fcba1a5d80e4dfe7cedba677e4351f2c40892a6bb4aee",
      "expected_behavior": "The correct key receives 25 matches and is selected uniquely.",
      "failure_consequence": "The contract prototype fails its only executable scientific control."
    },
    {
      "control_id": "near-positive-noisy-caesar",
      "class": "near-positive",
      "artifact_digest": "sha256:8acd9d4e0e258b940b7fcba1a5d80e4dfe7cedba677e4351f2c40892a6bb4aee",
      "expected_behavior": "Reserved for benchmark v1; no outcome is claimed by this foundation experiment.",
      "failure_consequence": "No production generalization claim may be made."
    },
    {
      "control_id": "negative-shuffled-text",
      "class": "negative",
      "artifact_digest": "sha256:8acd9d4e0e258b940b7fcba1a5d80e4dfe7cedba677e4351f2c40892a6bb4aee",
      "expected_behavior": "Reserved for benchmark v1; the final system must abstain from exact-recovery language.",
      "failure_consequence": "No specificity or manuscript claim may be made."
    },
    {
      "control_id": "adversarial-flexible-gloss",
      "class": "adversarial",
      "artifact_digest": "sha256:8acd9d4e0e258b940b7fcba1a5d80e4dfe7cedba677e4351f2c40892a6bb4aee",
      "expected_behavior": "Reserved for benchmark v1; flexible discovery fit must not pass confirmation.",
      "failure_consequence": "No complexity-sensitive or interpretation claim may be made."
    },
    {
      "control_id": "implementation-checkpoint-restart",
      "class": "implementation",
      "artifact_digest": "sha256:8acd9d4e0e258b940b7fcba1a5d80e4dfe7cedba677e4351f2c40892a6bb4aee",
      "expected_behavior": "Interrupted and uninterrupted executions have identical canonical output bytes.",
      "failure_consequence": "The worker is not eligible for distributed execution."
    }
  ],
  "search": {
    "algorithm": "Exhaustive integer key enumeration from 0 through 25 inclusive.",
    "implementation_digest": "sha256:7b9bd1869b22419e77f5661492e1ed54fcb3c9489e555371f8a375f6c419a2a8",
    "candidate_count": 26,
    "shard_size": 8,
    "selection_rule": "Maximize exact codepoint matches; break a tie by the smallest integer key."
  },
  "randomness": {
    "algorithm": "sha256-counter-v1",
    "master_seed_hex": "0000000000000000000000000000000000000000000000000000000000000000",
    "derivation": "No stochastic operation is used; the fixed field exercises the work-unit randomness contract."
  },
  "worker": {
    "artifact_digest": "sha256:7b9bd1869b22419e77f5661492e1ed54fcb3c9489e555371f8a375f6c419a2a8",
    "output_schema_digest": "sha256:32c01dd002da7278f0144f7fba93f4bdccabf0447f7b880072b99e6e65f8efc5",
    "entrypoint": "python benchmarks/workers/caesar_search.py",
    "deterministic": true,
    "network_access": false,
    "numeric_profile": "ascii-codepoints-integer-counts-single-thread-v1",
    "resource_limits": {
      "cpu_seconds": 5,
      "memory_bytes": 16777216,
      "disk_bytes": 1048576,
      "output_bytes": 4096,
      "wall_seconds": 10
    }
  },
  "validation": {
    "equivalence": "Exact SHA-256 equality of output artifact bytes.",
    "initial_replicas": 2,
    "quorum": 2,
    "max_replicas": 3,
    "reference_replay": "Replay every toy work unit locally and escalate disagreements to a third replica."
  },
  "stopping_rule": {
    "max_work_units": 4,
    "cpu_seconds_ceiling": 60,
    "futility_rule": "Stop and report failure if any executable positive or implementation control fails."
  },
  "claim_gate": {
    "max_tier": 0,
    "success_conditions": [
      "All 26 keys are evaluated exactly once by the aggregate search.",
      "Key 7 is the unique winner with 25 matching codepoints.",
      "Replicas and local reference replay produce identical output bytes."
    ],
    "failure_language": "This toy may demonstrate only that the foundation contracts and one disclosed oracle-scored fixture execute; it does not demonstrate cryptanalysis and says nothing about Voynich text, historical ciphers, or public volunteer readiness."
  }
}
